company_name_id,company_name,url,city,state,zip_code,ceo_first_name,ceo_last_name,year_founded,full_time_employees,company_type,company_category,revenue_source,description,description_short,financial_info,source_count,data_comments,dataset_wishlist,confidentiality,ts,survey_submitted,vetted,locked,vettedByCompany,display,notes
Legal-Science-Partners,Legal Science Partners,www.legalsciencepartners.net,Narberth,PA,19072,Margaret,Lee,2013,0,Private,Legal information,"Data Management and Analytic Services, Software Licensing","LSP is a private company with a public mission: to increase public and professional access to legal information. 

We are in the process of licensing our first product, LawAtlas: The Policy Surveillance Portal, to a new not-for-profit entity to be carried on as a public information service.  LSP is moving into the professional legal information market, developing new statutory and regulatory products that deliver highly accurate coded legal data to lawyers and other policy professionals.","We use scientific methods and our own copyrighted software to collect, code and publish statutory and regulatory legal information that is up-to-date, reliable and cost-efficient.","We are spin-off from Temple University and a Robert Wood Johnson Foundation National Program.  The Foundation's investmment in the original product, LawAtlas, was approximately $250,000, which produced a working policy surveillance portal. We are now in a social innovations incubator funded by the Bloomberg Foundation.",100+,"I couldn't make your search bar work, but it doesn't probably fit us anyway. We use statutes, regulations and local ordinances.  These are widely available for a fee, but free public access is more limited.  Also, in many instances public access is under a license that restricts commercial use. Since we also do longitudinal datasets, we have the additional problem of getting access to past laws, regualtions and ordinances.  Laws are not too difficult, but state regualtions and local ordinances are much more rarely preserved in a manner that allows access to superseded provisions.","State statutes and regulations; local ordinances.  Availability outside the main services (Westlaw and Lexis) is improving for statutes, but remains weak for regs. Ordinances are spotty.",,2014-03-28 22:15:23.619823,True,False,False,True,False,
Legcyte,(Leg)Cyte,http://www.legcyte.com,Washington,DC,20005,Aneet,Makin,2006,0,Public,Governance,Software Licensing,"(Leg)Cyte provides tools for Congressional staffers, lobbyists and public policy stakeholders. Our tools save users valuable time by streamlining, simplifying and ensuring more accurate legislative analysis. We're making legislation simple and smart.",LegCyte leverages technology to make legislation easier to understand and generates legislative insight and analytics and makes information sharing simple.,,,,,,2013-12-15 15:28:20.643000,True,False,False,True,True,
LegiStorm,LegiStorm,http://www.legistorm.com/,Washington,DC,0,,,0,,,,,,"LegiStorm launched in 2006 to bring valuable information about the people of Congress to the public, becoming widely known by being the only online source for staff salaries, financial disclosures, trips, gifts and earmarks.",,,,,,2013-12-15 15:28:25.599000,False,False,,False,True,
Legination-Inc,"LegiNation, Inc.",LegiNation.com,Los Angeles,CA,90013,Karen,Suhaka,2011,5,Private,Governance,Subscriptions,"LegiNation, Inc. was founded with the goal of making state level legislation more readily available to the professionals who need it, and even more importantly to the public at large. We are building products and websites to spark a renaissance in American politics, leveraging the internet to create the dialogue amongst our elected officials, legislative professionals, and everyday citizens.

BillTrack50 is available for everyone to research state and federal legislation and legislators any time, for free. Our goal is to help people become informed about what their government is doing, and to connect with their representatives to offer their insights and knowledge where and when they are needed. 

BillTrack50 also provides simple, elegant tools for tracking and sharing bills, as a subscription service. These tools are appropriate for professionals and organizations who need to keep on top of legislative developments, and keep others (and /or the public) informed about bills as they progress through the process.","LegiNation, Inc was founded to make state level legislation more readily available to professionals who need it and, more importantly, to the public at large.",,,,"An xml feed of legislation related information from the federal government, and then from the states.",,2013-12-15 15:27:42.814000,True,False,True,True,True,
Lending-Club,Lending Club,https://www.lendingclub.com,San Francisco,CA,94105,,,0,,,Finance & Investment,,,Lending Club is an online financial community that brings together creditworthy borrowers and savvy investors so that both can benefit financially - providing an alternative to the high cost and complexity of bank lending.,,,,,,2013-12-15 15:28:25.622000,False,False,,False,True,
Level-One-Technologies,Level One Technologies,http://www.levelonetechnologies.com,Maryland Heights,MO,63043,,,0,7,Private,Data/Technology,,"Level One Technologies creates user friendly web applications that integrate with your existing software to extend their life and value. Our customers continue to use the software they've invested in, while experiencing the benefits of sharing information and interacting with their business partners over the web. The result is a more efficient work flow that avoids the hassle and expense of developing, implementing and learning new systems. Our applications are highly customizable and allow us to quickly adapt to meet your business needs.  *Parrascope is a web based application that allows state agencies to manage and report their use of federal stimulus funds. This application is being co-developed and used by the Wyoming Department of Education. The initial version of the application was used to generate both monthly and quarterly ARRA reports. It has recently been expanded to include application and fund request functionality for the Education Jobs program.",Level One Technologies develops powerful web based applications that help businesses become more efficient and profitable.,,,,,,2013-12-15 15:28:25.644000,False,False,,False,True,
Leventis-Labs,Leventis Labs,http://www.leventislabs.com,San Francisco,CA,0,,,0,,,Research & Consulting,,,Leventis Labs provides product development consulting services primarily for new ventures and early-stage companies. ,,,,,,2013-12-15 15:28:25.668000,False,False,,False,True,
LexisNexis,LexisNexis,http://www.lexisnexis.com/en-us/home.page,New York,NY,10017,,,0,,Public,Business & Legal Services,,,"LexisNexis is a leading provider of content-enabled workflow solutions designed specifically for professionals in the legal, risk management, corporate, government, law enforcement, accounting, and academic markets.",,,,,,2013-12-15 15:28:25.691000,False,False,,False,True,
Lexmark-Solutions,Lexmark Solutions,http://www.lexmark.com/en_US/solutions/,Lexington,KY,40550,,,0,,Public,Data/Technology,,"Government agencies require content that is accurate, understandable and available to individual citizens, businesses, and researchers, as well as state, local governments or internal customers. Further complicating content access are civilian and federal workforces engaged in both classified and unclassified environments. ",Lexmark has a history of research and development focused on connecting unstructured print and digital information across an enterprise.,,,,,,2013-12-15 15:28:25.715000,False,False,,False,True,
Liberty-Mutual-Insurance-Cos,Liberty Mutual Insurance Cos.,http://www.libertymutual.com,Boston,MA,0,,,0,,,Insurance,,,Liberty Mutual Insurance provides a broad range of insurance products and services.,,,,,,2013-12-15 15:28:25.738000,False,False,,False,True,
LibertyBell-Law-Group,LibertyBell Law Group,http://libertybelllaw.com,Los Angeles,CA,91502,,,0,,Private,Business & Legal Services,,"All of our criminal attorneys work as part of a team who freely and seamlessly shares skills, strategies and resources. They have access to virtually every aspect of criminal law and a ""brain trust"" of effective defense strategies. When you hire LibertyBell Law Group, you get the collective experience of an entire team of the best criminal lawyers in the U.S.","LibertyBell Law Group's federal and criminal lawyers, criminal law specialists and experts are a collaborative team of lawyers from across the country.. ",,,,,,2013-12-15 15:28:25.762000,False,False,,False,True,
Lilly-Open-Innovation-Drug-Discovery,Lilly Open Innovation Drug Discovery,https://openinnovation.lilly.com/dd/,Indianapolis,IN,0,,,0,,,Scientific Research,,,"By providing a platform for idea-sharing, Open Innovation Drug Discovery lowers the barrier for collaborations between investigators working inside and outside an organization. ",,,,,,2013-12-15 15:28:25.786000,False,False,,False,True,
Liquid-Robotics,Liquid Robotics,http://liquidr.com,Sunnyvale,CA,94089,,,0,,Private,Geospatial/Mapping,,"The Wave Glider is changing both the economics and the technical envelope for ocean observation, data collection and communication. Offering the first platform for low-cost, persistent operations at sea, Liquid Robotics has attracted customers and users across its target markets in science, defense and oil & gas. Rather than spend $10K-$155K per day to operate an oceanographic vessel, customers can now launch an unmanned Wave Glider for months and up to a year of wide-ranging data collection. Leading organizations like the NOAA, BP and top oceanographic institutions have all adopted the Wave Glider for their unique mission requirements. ","Liquid Robotics provides ocean data services with Wave Glider, a wave powered marine robot designed to help address climate change, national security, hurricane and tsunami warning, and offshore energy and resource management.",,,,,,2013-12-15 15:28:25.808000,False,False,,False,True,
Locavore-,Locavore ,http://www.getlocavore.com,Madison,WI,53703,,,0,3,Private,Food & Agriculture,,"Think agrisourcing can only be implemented and managed by conglomerates? Think again. Local Dirt brings the potential of streamlined agrisourcing to the local marketplace, capturing inefficiencies and producing results. The company’s platform for mapping, sourcing, and enabling transactions around local food sources will insure that agrimarkets will never be the same.","Locavore enables users to find local, in-season food at nearby farmers' markets and farms.",,,,,,2013-12-15 15:28:25.832000,False,False,,False,True,
Lockheed-Martin,Lockheed Martin,http://www.lockheedmartin.com,Fort Worth,TX,0,,,0,,,Data/Technology,,," Lockheed Martin is the largest provider of IT services, systems integration, and training to the U.S. Government.",,,,,,2013-12-15 15:28:25.855000,False,False,,False,True,
LogixData,LogixData,http://www.logixdata.com,Sacramento,CA,0,,,0,,,Governance,,,"LogixData’s has been an innovator in artificial intelligence engines that can digitally read, translate, and structure global regulatory data. ",,,,,,2013-12-15 15:28:25.877000,False,False,,False,True,
Logixdata-Llc,"LOGIXDATA, LLC",www.logixdata.com,Sacramento,CA,95811,Ganesh,Rajappan,2009,0,Private,Data/Technology,Subscriptions,LogixData is a platform provider for intelligence mined from the SEC filings. Our Artificial Engine algorithms converts the information found in over 400 SEC form types to actionable data.,LogixData provides actionable insight and intelligence on publicly traded companies.,"Our revenues are obtained through subscription contracts with Public companies, Public accountants, Law firms and regulators. 
We are a organically built company with no external funding.
Our projected annual revenues are ~$2-$5M",,,Income tax data of corporations,,2014-01-04 21:07:29.323000,True,False,False,True,False,
LoopNet,LoopNet,http://www.loopnet.com,San Francisco,CA,94107,,,0,,Public,Housing/Real Estate,,"LoopNet operates the most heavily trafficked commercial real estate marketplace online with more than 7 million registered members and 5 million unique monthly visitors. No other commercial website can connect you directly to the buyers and tenants as effectively. In fact, approximately 76% of searchers on LoopNet are tenants and investors. ","LoopNet enables users to search listings, research properties, and list availabilities for commercial real estate.",,,,,,2013-12-15 15:28:25.902000,False,False,,False,True,
Loseitcom,LoseIt.com,http://loseit.com,Boston,MA,0,,,0,0,Private,Lifestyle & Consumer,Not reported by company,"Successful weight loss only happens when the changes you make are sustainable. That's why we created Lose It! to help you make smart, healthy eating choices that still leave room for your favorite foods.",Lose It! uses proven principles of weight loss (tracking and peer support) to help people manage their weight and improve their health.,,1-10,,,,2013-12-15 15:28:25.925000,False,False,False,False,True,
Lucid,Lucid,http://www.luciddesigngroup.com,Oakland,CA,94607,Vladi,Shunturov,2004,30,Private,Energy,"Software Licensing, Subscriptions",Lucid pioneered the concept of real-time feedback on energy and water use delivered on the web to save energy and save money in commercial buildings. Lucid's next endeavor is to transform the energy management industry with an operating system for buildings.,Lucid provides revolutionary energy management tools for commercial buildings.,"We have 30 employees, raised $1.5M in capital and are breakeven.",,,"A tariff engine that covers all utility rates, so companies can pass energy data and receive a bill breakdown in return.",,2013-12-15 15:27:42.882000,True,False,True,True,True,
M1T,M1T,http://www.m1tnews.com/!,New York,NY,10005,Anthony,Gude,2009,0,Private,Data/Technology,Other,M1T analyzes weather data and the effectiveness of weather controls.,"M1T is an American business focused on creating growth opportunities by making significant contributions within the Healthcare, Hospitality, Media, and Technology industries.","1M a year, very little startup investment",,,,,2013-12-17 00:15:26.636000,True,False,True,True,True,
MArch-Architects,M.Arch Architects,http://marcharch.com,New York,NY,10018,,,0,,,Housing/Real Estate,,,M.Arch Architects is a firm of architects and designers that use technology to mobililize and communicate its clients' ideas.,,,,,,2013-12-15 15:28:25.948000,False,False,,False,True,
Mango-Transit,Mango Transit,http://www.windowsphone.com/en-us/store/app/mango-transit/34083d75-dca6-4631-99be-4f9a3813dd73,Redmond,WA,0,,,0,1,Private,Geospatial/Mapping,,"App requires: Location services, data services, movement and directional sensor, compass.  Powered by Bing and Nokia.",Mango Transit is an advanced public transit app for Windows Phone. ,,,,,,2013-12-15 15:28:25.972000,False,False,,False,True,
MapQuest,MapQuest,http://www.mapquest.com,Denver,CO,80202,,,0,,Public,Geospatial/Mapping,,"Building on the core premise of providing accurate maps and directions to millions of people everyday, MapQuest.com is committed to making it easy for you to find local information, create your trips or journeys and customize, personalize and share them with others","As a top 20 website, MapQuest helps more than 40MM people per month, providing tools for Internet and mobile users, developers, and businesses. ",,,,,,2013-12-15 15:28:25.995000,False,False,,False,True,
Mapbox,MapBox,mapbox.com,Washington,DC,20009,Eric,Gundersen,2011,35,Private,Geospatial/Mapping,"Philanthropy, Subscriptions","MapBox is an open source platform for designing and publishing maps and geographical data for both mobile and on the web. On MapBox.com you can sign up and create a map within minutes, then simply embed the map via copy/paste on the web or build complex applications for web or mobile with it. Power anything from the contact page on a small blog to data visualizations of billions of data points to base maps for massive traffic on large scale sites. 

We started MapBox to make it easy for anyone to design and publish a beautiful custom map. Our platform gives developers the power to make maps that embody their product and brand. MapBox helps you find bars on foursquare, search for hotels on Hipmunk, and organize notes in Evernote. With our global, autoscaling infrastructure and cross-device compatibility, integrating our maps into your apps is easy even if you have millions of users. Over the last 3 years our team of dedicated cartographers, data analysts, and software engineers has built our entire stack using open source software and open data.",MapBox is an open source platform for designing and publishing maps and geographical data for both mobile and on the web.,"MapBox is growing fast. We have 2,000+ paid subscribers of our hosting service, and tens of thousands of free users using and experimenting with MapBox. A grant from the Knight Foundation allowed us to improve tools to edit OpenStreetMap, bringing in a wave of new contributors and improving this open map data that we - and many others - use in our basemap. Besides that, we have been fully bootstrapped.",,,"- National database of police station and prison locations
- Building Footprints datasets (available from some areas at city level)
- USPS Address points database and Census address point database
- Aerial photography of Hawaii and Alaska (not currentl",,2013-12-15 15:27:43.023000,True,False,True,True,True,
MarinExplore,MarinExplore,http://marinexplore.com,Sunnyvale,CA,94085,,,0,,Private,Environment & Weather,,"Marinexplore.com is organizing the Planet's ocean data with the leading community of ocean professionals, with tools that make it easy to find, access and share ocean data.  Marinexplore Enterprise is the world's first big data platform for ocean data, providing secure data workflow and analytics solutions for the offshore industry that minimize risk and cut data processing time fivefold.","MarinExplore provides seamless solutions for managing ocean data, analytics and collaboration.",,,,,,2013-12-15 15:28:26.018000,False,False,,False,True,
Marinexplore-Inc,"Marinexplore, Inc.",www.marinexplore.com,Sunnyvale,CA,94085,Rainer,Sternfeld,2012,10,Private,Data/Technology,"Data Management and Analytic Services, Software Licensing","Marinexplore has built the marineOS software - a cloud-based data platform, designed for ingesting diverse ocean data, allowing to streamline dataflows within a single extensible platform, and delivering powerful, easy to use tools for organizing, analyzing, visualizing, and securely distributing ocean data.","Marinexplore has built the ocean's big data platform, making sense of 4-dimensional marine data at scale.","Marinexplore has built the data platform in 20 months, with the help of private investors from US and Europe. In early 2014, the company has started with sales activities and is now generating revenue.",,,"Considering the state of ocean data, the main challenge for Marinexplore has been building the software that is able to aggregate the wide range of publicly available datasets, most of them using different standards and formats. Data availability has not been a material issue so far.",,2014-01-23 15:52:15.516000,True,False,False,True,False,
MarkLogic,MarkLogic,http://www.marklogic.com,San Mateo,CA,0,,,0,,,Data/Technology,,,"MarkLogic offers a new generation database technology capable of handling any data, at any volume, in any structure. ",,,,,,2013-12-15 15:28:26.042000,False,False,,False,True,
Marketsense,MarketSense,http://www.marketsense.com/,Sammamish,WA,98075,Tom,Poole,2013,5,Private,Business & Legal Services,Data Management and Analytic Services,"MarketSense is committed to providing actionable intelligence to create a more prosperous world by combining big data and digital marketing expertise.

We work directly with businesses, provide data aggregation, analysis and management services, and fully support agencies and their needs.",Data In... MarketSense Out!,MarketSense is growing quickly.  Revenues in 2014 will be under $5M.,1-10,,,,2014-03-19 18:00:06.176153,True,False,False,True,False,
Marlin--Associates,Marlin & Associates,http://www.marlinllc.com,New York,NY,0,,,0,,,Finance & Investment,,,"Marlin & Associates is a boutique financial and strategic advisory firm and investment bank advising U.S. and international companies that provide technology, digital information, and healthcare-related products and services.",,,,,,2013-12-15 15:28:26.065000,False,False,,False,True,
McGraw-Hill-Financial,McGraw Hill Financial,http://www.mhfi.com,New York,NY,0,,,0,,,Finance & Investment,,,"McGraw Hill Financial is a high-growth, high-margin benchmarks, content and analytics company serving the capital and commodity markets.",,,,,,2013-12-15 15:28:26.088000,False,False,,False,True,
McKinsey,McKinsey,http://www.mckinsey.com,New York,NY,10022,,,0,,Private,Research & Consulting,,"We work with leading organizations across the private, public and social sectors. Our scale, scope, and knowledge allow us to address problems that no one else can. We have deep functional and industry expertise as well as breadth of geographical reach. We are passionate about taking on immense challenges that matter to our clients and, often, to the world. ","McKinsey & Company is a global management consulting firm that advises the world's leading businesses, governments, and institutions.",,,,,,2013-12-15 15:28:26.112000,False,False,,False,True,
Medwatcher,MedWatcher,http://www.medwatcher.org,"Boston, MA",MA,0,John,Brownstein,0,0,Private,Data/Technology,"Data Management and Analytic Services, Database Licensing","MedWatcher is a web and mobile tool for both healthcare professionals and consumers that promotes drug, device, and vaccine safety. MedWatcher allows users to submit adverse event reports to the FDA using a streamlined form while providing them with real-time notifications of government safety alerts, reported adverse events, news and research, and social media activity for specified products. Endorsed and co-branded by the FDA, MedWatcher currently covers all US drugs, devices, and vaccines, with expansion into the EU in progress. 
 
Half of all Americans take a prescription drug, yet 86% of adverse drug events go unreported, according to HHS, with most reports coming from manufacturers. Reports that do get submitted are processed by the FDA and made public on an irregular basis -- monthly, quarterly, or sometimes even less frequently. This information system is slow, resulting in many missed safety signals, and puts patients at risk.
 
MedWatcher tackles this issue by making it vastly easier to report adverse events and by sharing adverse event data immediately with patient and provider communities. With direct involvement from patients, a high volume of data, and a user-friendly, transparent system, MedWatcher is a powerful tool for making drugs, devices, and vaccines safer.","MedWatcher is a user-friendly tool for tracking and reporting side effects of drugs, medical devices, and vaccines.",MedWatcher is a project out of Boston Children's Hospital and Harvard Medical School. It was created in collaboration with the Food and Drug Administration (FDA) Center for Devices and Radiologic Health (CDRH). Support from the FDA enables us to provide the MedWatcher tool to users at no charge.,,,"We combine adverse event reports from the FDA with those submitted via MedWatcher; our ability to provide much of this information, therefore, currently depends on FDA publishing its data. Timely access to this data and investigation updates would enable us to provide more robust safety information to our users.",,2014-01-23 14:48:45.182000,True,False,True,True,True,
Mendeley,Mendeley,http://www.mendeley.com,New York,NY,10010,,,0,,Private,Scientific Research,,"Imagine you have the opportunity to change the world for the better. Imagine things you’re working on have a real impact on how quickly people are able to find ways to cure major diseases or develop new technologies. That’s Mendeley’s vision, and we are transforming the world of academic research. Mendeley is a dynamic global research collaboration platform that is helping academics improve their workflow and accelerate the pace of scientific discovery. We've been named as tech start-up “Most likely to change the world for the better”. And even though it won’t be easy to achieve this goal, we think that’s the fun part! If you think so too, then why not join us? ",Mendeley is a dynamic global research collaboration platform that is helping academics improve their workflow and accelerate the pace of scientific discovery.,,,,,,2013-12-15 15:28:26.160000,False,False,,False,True,
