company_name_id,company_name,url,city,state,zip_code,ceo_first_name,ceo_last_name,year_founded,full_time_employees,company_type,company_category,revenue_source,description,description_short,financial_info,source_count,data_comments,dataset_wishlist,confidentiality,ts,survey_submitted,vetted,locked,vettedByCompany,display,notes
Recargo,Recargo,http://www.recargo.com,Venice,CA,90291,,,0,,Private,Energy,,"Wherever you are on the road to sustainable transportation, Recargo gives the critical intelligence you need to choose the right path forward. Which plug-in car should I buy? Where do I charge my car? How do I manage my organization's fleet of EVs? How can I voice my concerns to automakers, utilities and others in the industry? Recargo shows you the way.",Recargo is a software and services company that provides guidance to drivers and industry to support the adoption and growth of plug-in car technology.,,,,,,2013-12-15 15:28:27.770000,False,False,,False,True,
Red-Flags-,Red Flags ,http://www.redflags.info,,,0,,,0,,,Business & Legal Services,,"The web of liability is expanding. The legal liabilities of a company operating internationally are not limited to the domestic laws in host countries. Laws at home and in third countries may also apply. This web site lists activities which should raise a 'red flag' of warning to companies of possible legal risks, and the need for urgent action. "," This web site lists activities which should raise a 'red flag' of warning to companies of possible legal risks, especially when operating internationally, and the need for urgent action. ",,,,,,2013-12-15 15:28:27.792000,False,False,,False,True,
RedLaser,RedLaser,http://redlaser.com,San Jose,CA,95126,,,0,,,Lifestyle & Consumer,,"RedLaser is a barcode-scanning application for comparison shopping and finding product information using a mobile device. The state-of-the-art barcode scanning technology was created specifically to deal with non-autofocus cameras, and continues to evolve with innovative mobile visual capabilities. The RedLaser application has been downloaded over 2 million times. RedLaser is an eBay company (NASDAQ: EBAY)",RedLaser is a mobile application that makes it easy to access current deals at local stores or scan to discover if a better price is close by.,,,,,,2013-12-15 15:28:27.838000,False,False,,False,True,
Redfin,Redfin,http://www.redfin.com,Seattle,WA,98121,Glenn,Kelman,2004,300,Private,Housing/Real Estate,Brokerage Fees,"""The mission is to make real estate better, to make it more efficient, to make it more customer-focused.""",Redfin is a major technology-powered real estate brokerage firm helping people buy and sell homes.,"Annual revenue growth of more than 50%. Increase of more than 100% in home-selling transactions. More than $175 million in customer savings on real estate fees.
Leading investors: Tiger Global, T. Rowe Price, Greylock, DFJ, Madrona",,,"Local, current CPI and income data for affordability calculations.",,2013-12-17 19:57:21.971000,True,False,False,True,True,
Reed-Elsevier,Reed Elsevier,http://www.reedelsevier.com/Pages/Home.aspx,New York,NY,10017,,,0,,,Business & Legal Services,,,"Reed Elsevier is a leading provider of professional information solutions that serves professional customers across industries, helping them make better decisions, get better results and be more productive.",,,,,,2013-12-15 15:28:27.863000,False,False,,False,True,
Rei-Systems,REI Systems,www.reisystems.com,Sterling,VA,20166,Veer,Bhartiya,1989,0,Private,Data/Technology,Data Management and Analytic Services,"REI Systems delivers reliable, effective, and innovative solutions by partnering with its customers to address complex business challenges. We deliver web-based technologies supporting open source, data analytics and presentation, and full life-cycle case management solutions in the areas of open government, grants management, performance management, and cloud implementation. REI's employees seek to  deliver solutions and services to empower people and make a difference.",REI Systems is a leading provider of federal open government/transparency solutions and has built many high-profile websites in the federal government.,"REI is a privately held corporation with ownership held by its co-founders and an Employee Stock Ownership Plan. Our company is classified as a large business, with revenues of $72 million in 2013, and substantial growth over the past several years. Our company is healthy, with top credit ratings from Dun & Bradstreet.",,,Would like to see more transparency on acquisition strategies across agencies,,2014-01-07 19:29:10.478000,True,False,False,True,False,
Relationship-Science,Relationship Science,https://www.relsci.com,New York,NY,10022,,,0,,Private,Business & Legal Services,,"Relationship Science (RelSci) is the ultimate business development tool. It provides deep information about influential people - who they are and who they know, what you have in common with them, and most importantly, how you can gain access to them and their organizations. RelSci helps you discover new relationships, advance existing ones, and maximize every opportunity.","The Relationship Science (RelSci) platform contains robust profiles on over three million important decision-makers and the one million organizations they work with across the public, private, finance, and nonprofit sectors. ",,,,,,2013-12-15 15:28:27.886000,False,False,,False,True,
ReportLinker,ReportLinker,http://www.reportlinker.com,,,0,,,0,,,Data/Technology,,,ReportLinker is the only search engine to provide official statistics from both public and private sources.,,,,,,2013-12-15 15:28:27.909000,False,False,,False,True,
Reputationcom,Reputation.com,http://www.reputation.com,Redwood City,CA,94063,,,0,,,Business & Legal Services,,,"Reputation.com gives individuals and businesses the ability to control how they look online, with technology to help them assess their online reputations and  monitor, manage, and secure their information on the Internet.",,,,,,2013-12-15 15:28:27.932000,False,False,,False,True,
Resources-for-the-Future,Resources for the Future,http://www.rff.org/Pages/default.aspx,Washington,DC,20036,,,0,,,Environment & Weather,,,Resources for the Future improves environmental and natural resource policymaking worldwide through objective social science research of the highest caliber.,,,,,,2013-12-15 15:28:27.956000,False,False,,False,True,
Retroficiency,Retroficiency,http://www.retroficiency.com,Boston,MA,2114,,,0,,Private,Energy,,"Retroficiency enables utilities and large energy service providers to drive deeper building energy efficiency savings in less time and at lower a cost from traditional approaches. Our Building Efficiency Intelligence platform develops energy models that deliver insights and recommendations to help target buildings, engage customers, convert projects, and track opportunities more effectively and at scale. ",Retroficiency's mission is to scale energy efficiency in buildings. ,,,,,,2013-12-15 15:28:27.979000,False,False,,False,True,
Revelstone,Revelstone,http://www.revelstonelabs.com,,,0,Ken,Wolf,2010,0,Private,Governance,Software Licensing,"Revelstone's mission is to create communities of local organizations that inspire each other to improve the quality of life for their citizens. Revelstone provides a web-based performance analytics and benchmarking platform specifically designed for local governments, to fulfill this mission.    

Revelstone helps municipalities of all sizes who seek to do more with less. Revelstone Compass centralizes key performance metrics for municipal leaders to make data driven decisions based on facts, not politics, to help drive new efficiencies and improved outcomes for citizens.",Revelstone provides a web-based performance analytics and benchmarking platform specifically designed for local governments with its Compass solution.,,,,,,2013-12-17 00:15:27.368000,True,False,True,True,True,
Rezolve-Group,Rezolve Group,http://www.rezolvegroup.com,Sacramento,CA,95827,,,0,,Private,Education,,"Helping college students is our mission at Rezolve Group, Inc. It is also our passion. We are an innovative technologies and services company that focuses exclusively on post-secondary student financial aid. We offer challenging career opportunities and a true commitment to serving our clients. We recognize the value of inventive, hardworking, and passionate employees because our business is built on these attributes. We are a dynamic and rapidly growing entrepreneurial company and employ 300+ employees throughout the U.S. with offices in Sacramento, CA (corporate office), Lawrence, KS, Indianapolis, IN, and Boston, MA.",The Rezolve Group is an innovative technologies and services company that focuses exclusively on post-secondary student financial aid. ,,,,,,2013-12-15 15:28:28.003000,False,False,,False,True,
Ripoff-Report,Ripoff Report,http://www.ripoffreport.com,Tempe,AZ,0,,,0,,,Lifestyle & Consumer,,,"Ripoff Report is a consumer reporting Web site and publication, by consumers, for consumers, to file and document complaints about companies or individuals. ",,,,,,2013-12-15 15:28:28.026000,False,False,,False,True,
Rivet-Software,Rivet Software,http://rivetsoftware.com,Denver,CO,80237,,,0,,,Finance & Investment,,,"Rivet Software uses XBRL to create, exchange, present, and consume financial information for greater transparency, improved efficiencies, and reduced risk.",,,,,,2013-12-15 15:28:28.050000,False,False,,False,True,
Roadify,Roadify,www.roadify.com,New York City,NY,11215,Scott,Kolber,2010,5,Private,Transportation,"Lead Generation To Other Businesses, Subscriptions","Roadify is a data platform and mobile application for transit information. Roadify uses open data to solve a universal problem—making it easy for people to learn when their bus, train, subway, etc is coming and why it’s late if it’s not there.  Roadify has the scale to provide information for public signage at transit hubs and elsewhere—including Brooklyn’s Barclays Center, New York’s City 24x7 kiosks and the Philadelphia Convention Center.  Roadify has strategic relationships with Cisco and Veolia Transportation around data management and content distribution.

Roadify’s model is simple:
1. Aggregate open real-time arrival, advisory and schedule data from transit agencies with tweets and comments from users. Distribute this content: i) through partner networks on a localized basis, such as sports and entertainment venues, hotels, retailers, outdoor display, websites and other mobile apps and ii) through our own mobile app 
2. Build a global user base by addressing a daily, chronic, universal information need—“when is my ride coming and why is it late?”
3. Make it easy for 1) venues and enterprises to display this content paid for by subscription fees and 2) riders to book multi-mode urban ground transportation services from our app and partners",Roadify makes it easy to find out when your mass transit ride is coming and to book ground transportation services.,"Roadify is a privately held, angel funded company.",,,We would like to see all transit agencies make their schedule and real time data available.,,2013-12-18 20:25:10.923000,True,False,True,True,True,
Rowdmap,Rowdmap,http://rowdmap.com,Louisville,KY,40202,,,0,,,Healthcare,,,"Rowdmap organizes health care market data, performance data, and key driver data into meaningful information.",,,,,,2013-12-15 15:28:28.095000,False,False,,False,True,
Russell-Indexes,Russell Indexes,http://www.russell.com/indexes/,Seattle,WA,98101,,,0,,,Finance & Investment,,,"Russell Indexes provides tools to help investors build, track and trade investment portfolios. ",,,,,,2013-12-15 15:28:28.119000,False,False,,False,True,
SAIC,SAIC,http://www.saic.com/,New York,NY,10001,,,0,,,Data/Technology,,,"SAIC is a leading technology integrator providing full lifecycle services and solutions in the technical, engineering and enterprise information technology sectors.",,,,,,2013-12-15 15:28:28.163000,False,False,,False,True,
SAP,SAP,http://www.sap.com/,Newtown Square,PA,19073,,,0,,,Data/Technology,,,SAP AG is a world leader in enterprise software and software-related services.,,,,,,2013-12-15 15:28:28.189000,False,False,,False,True,
SAS,SAS,http://www.sas.com/,Cary,NC,0,,,0,,,Data/Technology,,,"SAS is a software suite developed by SAS Institute for advanced analytics, business intelligence, data management, and predictive analytics. ",,,,,,2013-12-15 15:28:28.212000,False,False,,False,True,
Sage-Bionetworks,Sage Bionetworks,http://sagebase.org,Seattle,WA,98109,,,0,,,Scientific Research,,,"Sage Bionetworks works to redefine how complex biological data is gathered, shared and used, building platforms and services and undertaking research developing predictors relating to health..",,,,,,2013-12-15 15:28:28.142000,False,False,,False,True,
Science-Exchange,Science Exchange,scienceexchange.com,Palo Alto,CA,94301,Elizabeth,Iorns,2011,0,Private,Scientific Research,User Fees for Web or Mobile Access,"Science Exchange is an online platform seeking to provide easy access to the global network of scientific resources and expertise. The platform functions as a marketplace helping research scientists find the expertise and services they need at other university labs, core facilities, and contract research organizations. The objective is to help improve the pace of scientific research by improving the efficiency by which researchers can search for, compare and order scientific services on an open marketplace platform.

For service providers, Science Exchange aims to increase utilization and quality recognition within an open marketplace. Service providers are government funded core facilities and university labs, which have difficulty in promoting services for external use, and tracking impact of services. Science Exchange helps researchers find the facility's services in a centralized platform, and increase utilization of labs that are running below capacity. The platform also allows for tracking of all work performed, and publications resulting from work performed on the site with collaborates - making management and reporting of service labs easier.

Overall, the goal of Science Exchange is to help scientists access the resources and expertise at university based institutions, that they otherwise could not find, afford, or access.","Science Exchange's goal is help researchers access the world's scientific expertise, advancing open science initiatives to change the pace of scientific research.","Science Exchange is a venture-backed company, started as part of Y Combinator, with funding from top VC firms including Andreessen Horowitz, O'Reilly AlphaTech Ventures, and Union Square Ventures. We strategically choose investment from firms like OATV, matching our open access mission.

We actively collaborate, participate, and support open science. We've partnered with eagle-i to improve access to government-funded resources in online directories, & established the Reproducibility Initiative to leverage our online network of service providers to validate public studies, and publish results in open access journals. We received support from nonprofits such as the Arnold Foundation to pursue these goals.",,,"A central resource of all researchers, postdocs, and government funded grad students so that federal grant funding could be easily identified to specific individuals. Will help link funding sources to actual work and services ordered, and in turn the publications resulting from the specific grant funding.",,2013-12-15 15:27:44.553000,True,False,True,True,True,
Seeclickfix,SeeClickFix,en.seeclickfix.com,New Haven,CT,6510,Ben,Berkowitz,2008,18,Private,Governance,"Advertising, Software Licensing","SeeClickFix is a communications platform for citizens to report non-emergency issues, and governments to track, manage, and reply--ultimately making communities better through transparency, collaboration, and cooperation.

They say all politics is local. While we're not political, we do believe that changes that have a real impact on our daily lives occur at the block, neighborhood or city level. It's our goal to provide the best tools for residents and governments to communicate for all sizes, populations, and budgets.

SeeClickFix could not be done without help. On top of the passionate, fast-growing team of entrepreneurs at SeeClickFix, it is really only made possible by the amazing volunteers, citizens, and members of governments large and small who are passionate about everything civic.","SeeClickFix allows anyone to report and track non-emergency issues anywhere via the internet, empowering citizens, community groups, media organizations and governments to improve their neighborhoods.",,,,,,2013-12-15 15:27:44.624000,True,False,True,True,True,
Sharecare-,Sharecare,http://www.sharecare.com/,San Diego,CA,92121,,,0,,Private,Healthcare,,"RealAge, Inc. is a consumer-health media company and provider of personalized health information and management tools. These tools motivate health-conscious people like you to look, feel, and actually be many years younger—to Live Life to the Youngest®. RealAge has been featured on national radio and television programs including 20/20, Good Morning America, the Today show, and The Oprah Winfrey Show. RealAge is a subsidiary of Sharecare, Inc.","Sharecare, a leading online health and wellness engagement platform, provides millions of consumers with a personal, results-oriented service that connects them to qualified health resources and programs to improve their health.",,,,,,2013-12-15 15:28:28.235000,False,False,,False,True,
ShufflePoint,ShufflePoint,http://www.shufflepoint.com/,Brookfield,CT,6804,,,0,,,Business & Legal Services,,,"ShufflePoint is a report integration hub, pulling data from multiple sources and pushing data to multiple destinations and formats. ",,,,,,2013-12-15 15:28:28.258000,False,False,,False,True,
SigActs,SigActs,http://www.sigacts.com/,Mountain View,CA,0,,,0,,,Geospatial/Mapping,,"Significant Activities, abbreviated as SigActs, is a military term that refers to incidents occurring on a battlefield.  In today’s globalized economy, news and events transpiring around the world can have an impact on international supply chains and local public safety. SigActs.com is an attempt to identify and display the geographic relevance of news from around the globe.","SigActs, launched with expertise from the U.S. defense and intelligence communities, tracks ""significant"" events worldwide. ",,,,,,2013-12-15 15:28:28.282000,False,False,,False,True,
SigFig,SigFig,https://www.sigfig.com/,San Francisco,CA,94103,,,0,,,Finance & Investment,,,SigFig tracks individuals' financial assets and provides detailed visualizations of their investments and recommendations on how to manage them.,,,,,,2013-12-15 15:28:28.305000,False,False,,False,True,
Simple-Energy,Simple Energy,http://simpleenergy.com,Boulder,CO,80302,Yoav,Lurie,2010,25,Private,Energy,Software Licensing,"Simple Energy leverages energy data analytics, individualized messaging, and leading behavioral science to motivate customers to take the actions their utilities value most. We interact with customers in real-time across the platforms people use most email, web, mobile, social, and print, to build a more dynamic relationship between utilities and their customers.","Simple Energy leverages energy data analytics, individualized messaging, and leading behavioral science to motivate customers to take the actions their utilities value most.",,,,a repository that aggregates state regulatory dockets for utility companies,,2013-12-15 15:27:44.695000,True,False,True,True,True,
SimpleGeo,SimpleGeo,http://urbanairship.com/,San Francisco,CA,94103,,,0,,,Geospatial/Mapping,,,SimpleGeo (acquired by Urban Airship in 2011) provides a ready-to-use location infrastructure that makes it easy to add location-aware features to applications. ,,,,,,2013-12-15 15:28:28.351000,False,False,,False,True,
SimpleTuition,SimpleTuition,http://www.simpletuition.com/,Boston,MA,2210,,,0,,Private,Education,,"SimpleTuition helps more than 10 million students a year afford higher education. The company provides tips, advice, interactive tools that ensure students plan better for college costs, pay less for college-related expenses, and be smarter about how they manage and pay back their student loans. In addition to SimpleTuition.com, the company manages ValoreBooks, SmarterBucks Rewards, and SmarterBank. Named Best Financial Services Site by Kiplinger's, SimpleTuition is headquartered in Boston, Mass., and is funded by Atlas Venture, Flybridge Capital Partners, and North Hill Ventures.",The goal of SimpleTuition is to make it easier for students and their families to afford a higher education. ,,,,,,2013-12-15 15:28:28.375000,False,False,,False,True,
Simplee,Simplee,http://www2.simplee.com/,Palo Alto,CA,94306,,,0,,Private,Healthcare,,"The rise in high deductible health plans and an antiquated billing process leaves the typical person confused and conditioned to deprioritize paying medical bills. Providers see the effects in rising collection costs, high customer support loads, low satisfaction scores, and mounting bad debt.  Simplee® is committed to helping patients have confidence in what they owe and why, and making the health care payment process as trusted and convenient as possible.","Simplee is committed to helping patients have confidence in what they owe and why, and making the health care payment process as trusted and convenient as possible.",,,,,,2013-12-15 15:28:28.328000,False,False,,False,True,
Sitecompli,SiteCompli,www.sitecompli.com,New York,NY,10010,,,2008,25,Private,Housing/Real Estate,Subscriptions,"SiteCompli's technology automatically and continuously aggregates critical data on violations, complaints, inspections, fines, hearings, jobs and permits for real estate owners and managers throughout New York City. SiteCompli tracks and analyzes compliance issues from the City’s key agencies including the Department of Buildings, Environmental Control Board, Department of Sanitation, Fire Department, and more, providing clients a digital view of all of their compliance data. SiteCompli clients save time, money, and can now navigate the increasingly complex and high stakes NYC regulatory environment.
 
Founded in 2008 by Jason Griffith and Ross Goldenberg, SiteCompli monitors over 1 billion square feet of real estate across 35,000 buildings for the leading residential and commercial owners and managers in New York.","SiteCompli technology continuously and automatically monitors and alerts on critical compliance issues, saving NYC’s leading property owners and managers time and money while reducing risk.","Since launching in 2008, SiteCompli has become the NYC real estate industry standard for compliance monitoring. The City's leading property managers and owners use SiteCompli as part of their company’s best practices for maintaining a safe and compliant portfolio. To date, SiteCompli monitors over 1 billion square feet of real estate across more than 35,000 buildings in the five boroughs; the company has had 1200% revenue growth since 2008.

Leading residential and commercial owners and managers clients in New York include Vornado, CBRE, Cushman & Wakefield, Related, First Service Residential, and many others.",10-50,,"SiteCompli is pleased that open data is being prioritized by city, state and federal governments. We hope for a continued commitment to the dissemination of timely, accurate and pertinent sets of data.",,2014-03-14 20:02:58.497305,True,False,False,True,False,
Slashdb,SlashDB,http://www.slashdb.com/,Jersey City,NJ,7305,Victor,Olex,2010,4,Private,Data/Technology,"Data Management and Analytic Services, Software Licensing, Consulting","SlashDB instantly transforms traditional databases into online resources. Use it internally for data integration or as a backend for web and mobile applications.

Enterprise use cases:

- data federation, integration and virtualization
- backend for mobile enterprise applications
- self-service reporting and business intelligence
- alternative or a complement to data warehousing
- data level interoperability with clients/partners

Web and e-commerce:

- instantly add an API to existing website
- monetize data assets
- build attractive data visualizations in HTML5 and native mobile apps by leveraging databases
- build affiliate widgets and programs in record time","Government data ""sleeps"" in databases. SlashDB instantly adds a web API so the data becomes accessible to authorized web and mobile applications and analytics systems.","In 2013 SlashDB has teamed up with Amazon Web Services to offer our product to their cloud customers. In the same year we also partnered with API management company 3Scale to allow their prospective clients build APIs in record time.

We are actively pursuing lasting relationships with cloud vendors, API management firms and system integrators. To that end SlashDB offers referral and value-added reseller programs.",1-10,Nothing to add.,"Any data residing in a database can be easily opened up to the public or authorized partners, clients and government agencies.",,2013-12-15 15:28:28.399000,True,False,False,True,True,
