company_name_id,company_name,url,city,state,zip_code,ceo_first_name,ceo_last_name,year_founded,full_time_employees,company_type,company_category,revenue_source,description,description_short,financial_info,source_count,data_comments,dataset_wishlist,confidentiality,ts,survey_submitted,vetted,locked,vettedByCompany,display,notes
1099Is,1099.is,http://1099.is,New York,NY,0,Craig,Shapiro,1980,0,Public,Finance & Investment,Data Management and Analytic Services,"Working for yourself has different tax implications than the standard, employer-facilitated W-2 filing. The self-employed are at greater risk of an IRS audit, making accurate filing critical. Expenses, deductions and self-employment tax – all factor into determining how much is owed on every April 15th.  The tax code for the self-employed is confusing and inaccessible. 1099.is provides advice from experts and people who have been through this before in transparent, clear, simple language. 1099.is’s goal is to consolidate this information into one central resource to make it easy for anyone on any platform to find help.","1099.is helps people navigate the confusing tax code that applies to the self-employed, providing expert advice in transparent, simple language.",,1-10,,,,2013-12-15 15:28:20.677000,True,False,False,True,True,
1800Recyclingcom,1800Recycling.com,http://1800recycling.com,Fresno,CA,93711,,,0,0,Public,Environment & Weather,,"1-800-RECYCLING.com is a dynamic recycling and green living-focused website that makes recycling, conserving, reusing and living wisely easy.  1-800-RECYCLING.com features a comprehensive recycling location database that gives the user the ability to easily assemble a recycling to-do list. The database is location based, and aims to make your recycling needs as easy as possible, whether you’re clearing out the house during spring cleaning or simply looking to recycle a few shopping bags.",This company is a search engine for recycling locations.,,,,,,2013-12-15 15:28:20.700000,False,False,False,False,True,
3-Round-Stones-Inc,"3 Round Stones, Inc.",3RoundStones.com,Washington,DC,20004,Bernadette,Hyland,2010,4,Private,Data/Technology,"Data Management and Analytic Services, Subscriptions","3 Round Stones produces a platform for publishing data on the Web. 3 Round Stones provides commercial support for the Callimachus Data Platform, used by the Fortune 2000 and US Government Agencies publishing and consuming data.  Headquartered in Arlington, Virginia, we're seasoned entrepreneurs who are passionate about solving real world problems through open data and open Web standards.","Our Open Source platform is used by the Fortune2000 and US Government Agencies to collect, publish and reuse data, both public and proprietary.","3 Round Stones is a profitable, self-funded, woman-owned start-up.  Our team has several successful serial entrepreneurs.  As entrepreneurs, we've benefited from the valuable guidance by seasoned advisers and mentors in the mid-Atlantic region who have guided our team through multiple start-ups, outside funding and an acquisition by a Fortune 100 company in 2005.",,,"The formats and custom APIs make it cumbersome for developers to re-use content meaningfully.  Often, the context, license and data model for the data are missing.  More assistance to publish according to Web Best Practices for structured data need to be defined, communicated and implemented by Government Agencies and contractors.",,2013-12-15 15:27:46.116000,True,False,True,True,True,
5Psolutions,5PSolutions,www.5psolutions.com,Fairfax,VA,22003,Harjit,Singh,2007,2,Private,Data/Technology,"Subscriptions, User Fees for Web or Mobile Access","At 5PSolutions, we wish to make all basic information of different categories easily available to via tablets or phones.",5PSolutions are artisans of mobile platforms.,,,,,,2014-01-05 01:42:01.942000,True,False,False,True,False,
AHC-Media,AHC Media,http://www.ahcmedia.com/public/,Atlanta,GA,30305,,,0,,,Healthcare,,,"For over 30 years, professionals have used AHC Media to help them manage the complex web of regulatory requirements placed upon medical providers, practitioners, and suppliers. ",,,,,,2013-12-15 15:28:20.935000,False,False,,False,True,
Abt-Associates,Abt Associates,abtassoc.com,Cambridge,MA,2138,Kathleen,Flanagan,1965,2500,Private,Research & Consulting,Data Management and Analytic Services,"Abt Associates is a mission-driven, international company conducting research and program implementation in the fields of health, social and environmental policy, and international development. The company has multiple offices in the U.S. and program offices in more than 40 countries.","Abt Associates is a mission-driven, global leader in research and program implementation in the fields of health, social and environmental policy, and international development.",Employee-owned company. $552M/year.,,,"Linkages among location-based records from different federal/open data sources for which there is a federal/public interest.
Open use corporate linkages to ultimate US parents.",,2013-12-15 15:27:46.253000,True,False,True,True,True,
Accela,Accela,http://www.accela.com,San Ramon,CA,94583,,,0,0,Private,Governance,Not reported by company,"Today, Accela powers thousands of services and millions of transactions for more than 500 public agencies worldwide, enabling governments to connect with citizens and streamline processes related to land management, asset management, licensing, and public health & safety. It is fair to say we have a heritage and a tradition of powering civic excellence.  Accela addresses a broad range of agency, business and citizen needs, and includes built-in payment, scheduling, compliance and information transparency. Together with our partners, Accela can custom-tailor solutions based on precise agency specifications, or deploy packaged solutions based on best practice templates and pre-defined services in a matter of a few weeks.","Accela improves citizen engagement by making it easier to do government business, driving civic innovation and improving transparency, accuracy and accountability.",,100+,,,,2013-12-15 15:28:20.725000,False,False,False,False,True,
Accelrys,Accelrys,http://accelrys.com,San Diego,CA,92121,,,0,,,Scientific Research,,,"Accelrys enables scientific innovators to access, organize, analyze and share data with the goal of enhancing innovation, improving productivity and compliance, reducing costs and speeding time from lab to market.",,,,,,2013-12-15 15:28:20.748000,False,False,,False,True,
Accenture,Accenture,http://www.accenture.com/us-en/pages/index.aspx,Phoenix,AZ,85018,,,0,275000,Private,Data/Technology,Not reported by company,"Accenture delivers its services and solutions through 19 focused industry groups in five operating groups. This industry focus provides Accenture’s professionals with a thorough understanding of industry evolution, business issues and applicable technologies, enabling Accenture to deliver solutions tailored to each client's industry.","Accenture describes itself as a leader in providing management consulting, technology and outsourcing services.",,NA,,,,2013-12-15 15:28:20.772000,False,False,False,False,True,
Accuweather,AccuWeather,http://www.accuweather.com,State College,PA,16801,,,1962,404,Private,Environment & Weather,Subscriptions,"We provide local forecasts for everywhere in the United States and over two million locations worldwide. We also provide our products and services to more than 175,000 paying customers in media, business, government and institutions. Our headquarters in State College, PA, is home to the greatest number of forecast meteorologists in one location anywhere in the world.","AccuWeather describes its mission as helping to save lives, protect property, and helping people to prosper through weather information.",,NA,,,,2013-12-15 15:28:20.794000,False,False,False,True,True,
Acxiom,Acxiom,http://acxiom.com,Little Rock,AR,72201,,,0,0,,Data/Technology,Not reported by company,"Acxiom is an enterprise data, analytics and software as a service company. For more than 40 years, Acxiom has harnessed the powerful potential of data to strengthen connections between people, businesses and their partners.","Acxiom is an enterprise data, analytics and software-as-a-service company,  using data to connect people, businesses and their partners.",,100+,,,,2013-12-15 15:28:20.819000,False,False,False,False,True,
Adaptive,Adaptive,http://www.adaptive.com,Irvine,CA,92618,,,0,,Private,Business & Legal Services,,"Information, though routinely misaligned, remains the lifeblood of every organization.  It is essential today to know how critical data moves across an enterprise.  Adaptive offers standards-based solutions that help organizations better align their valuable information by supporting specific management challenges including Data Governance, Data Quality, Metadata Management, Enterprise Architecture Management and IT Portfolio Management.","Adaptive helps organizations leverage what they have in the most optimal manner to provide a knowledge management asset that facilitates reuse, analytics and compliance throughout the organization.",,,,,,2013-12-15 15:28:20.842000,False,False,,False,True,
Adobe-Digital-Government,Adobe Digital Government,http://www.adobe.com,San Jose,CA,95510,,,0,0,,Data/Technology,Not reported by company,,"Adobe delivers solutions that help government agencies make, manage, mobilize, and measure the information and experiences needed to achieve their missions.",,100+,,,,2013-12-15 15:28:20.866000,False,False,False,False,True,
Ag-Professional,Ag Professional,http://www.agprofessional.com,,KS,0,,,0,,,Food & Agriculture,,,"AgProfessional provides agronomic and business management solutions to retailers/distributors, professional farm managers and crop consultants, to help increase production and profitability in the food, fiber and energy markets. ",,,,,,2013-12-15 15:28:20.889000,False,False,,False,True,
Agilix,Agilix,http://agilix.com,Philadelphia,PA,19106,,,0,,,Education,,,"Agilix was founded in 2001 by the principals who built first Folio and then Ancestry.com, who then focused on the rapidly changing education market, creating BrainHoney, Buzz, and the Extensible Learning Infrastructure, or xLi.",,,,,,2013-12-15 15:28:20.912000,False,False,,False,True,
Aidin,Aidin,http://www.myaidin.com,New York,NY,10001,,,0,0,Private,Healthcare,Not reported by company,"Aidin was created specifically for discharge planning professionals. Aidin integrates into the discharge planning workflow to free social workers from administrative tasks and re-center their time around patients. By automatically generating listings of available providers, Aidin eliminates phone calls and faxes and empowers patients with quality of care ratings and reviews to make decision-making quick, easy, and informed. Aidin works with hospitals to track patient experiences and outcomes to help case managers gain insight into which post-acute providers best serve specific health conditions.",Aidin's mission is to bring transparency to the healthcare system and empower patients with data to make more informed decisions on where they receive care.,,NA,,,,2013-12-15 15:28:20.957000,False,False,False,False,True,
AllScripts,AllScripts,http://www.allscripts.com,Chicago,IL,60654,,,0,,,Healthcare,,,AllScript's goal is to be the most trusted provider of innovative solutions that empower stakeholders across the healthcare continuum to deliver improved outcomes.,,,,,,2013-12-15 15:28:21.027000,False,False,,False,True,
AllState-Insurance-Group,AllState Insurance Group,http://www.allstate.com,Northbrook,IL,60062,,,0,,,Insurance,,,"The Allstate Corporation is the largest publicly held personal, property and casualty insurer in America. ",,,,,,2013-12-15 15:28:21.051000,False,False,,False,True,
Allianz,Allianz,http://www.allianzusa.com,New York,NY,10019,,,0,0,,Finance & Investment,Not reported by company,,"Allianz Life Insurance Company is a provider of retirement solutions, including fixed and variable annuities and life insurance for individuals.",,NA,,,,2013-12-15 15:28:20.981000,False,False,False,False,True,
Allied-Van-Lines,Allied Van Lines,http://www.allied.com,Westmont,IL,60559,,,0,0,Private,Transportation,Not reported by company,"Allied Van Lines is a global relocation company, serving individuals and corporations all over the world for their transportation and storage needs.","As part of Allied's moving services, the company offers customized solutions for  local, interstate and international moves.",,NA,,,,2013-12-15 15:28:21.005000,False,False,False,False,True,
Alltuition,Alltuition,https://www.alltuition.com,Chicago,IL,60611,,,0,10,Private,Education,Not reported by company,"Alltuition.com makes sure you don’t miss out on financial aid. Based on the colleges where you're applying for aid, we instantly match you to your opportunities and help you maximize your chances for aid.",Alltuition enables high school students and their families to manage the financial aid process from start to finish.,,NA,,,,2013-12-15 15:28:21.074000,False,False,False,False,True,
Altova,Altova,http://www.altova.com,Beverly,MA,1915,,,0,0,,Data/Technology,Not reported by company,,"Altova is a software company specializing in tools to assist developers with data management, software and application development, and data integration.",,NA,,,,2013-12-15 15:28:21.098000,False,False,False,False,True,
Amazon-Web-Services,Amazon Web Services,http://aws.amazon.com,Seattle,WA,0,,,0,0,Public,Data/Technology,Not reported by company,"Amazon Web Services is a collection of remote computing services that together make up a cloud computing platform, offered over the Internet by Amazon.com. The most central and well-known of these services are Amazon EC2 and Amazon S3.",Amazon provides cloud computing services through Amazon Web Services to a range of clients.,,100+,,,,2013-12-15 15:28:21.121000,False,False,False,False,True,
American-Institute-of-Architects,American Institute of Architects,http://www.aia.org,Washington,DC,20006,,,0,,,Business & Legal Services,,,"Based in Washington, D.C., the AIA has been a professional membership association for licensed architects, emerging professionals, and allied partners since 1857.",,,,,,2013-12-15 15:28:21.145000,False,False,,False,True,
American-International-Group,American International Group,http://www.aig.com/home_3171_411330.html,New York,NY,10038,,,0,,,Insurance,,,"American International Group, Inc. (AIG) is a leading international insurance organization serving commercial, institutional, and individual customers through an extensive worldwide property-casualty network.",,,,,,2013-12-15 15:28:21.168000,False,False,,False,True,
American-Red-Ball-Movers,American Red Ball Movers,http://www.redball.com,Indianapolis,IN,46239,,,0,0,,Transportation,Not reported by company,"American Red Ball Movers, established in 1919, is a major long distance moving company in the US.",Red Ball is a long distance and corporate relocation moving company that serves families and businesses.,,NA,,,,2013-12-15 15:28:21.191000,False,False,False,False,True,
Amida-Technology-Solutions,Amida Technology Solutions,http://amida-tech.com/index.html,Washington,DC,20036,Peter,Levin,2013,5,Private,Healthcare,,"Amida develops patient-centered solutions based on the Blue Button personal health record (PHR). The Amida Personal Health Information Exchange solution allows enterprises to offer capabilities that place the patient at the center of their health data. It enables two-way communication between patients and primary care physicians, pharmacies, labs, and specialty care providers. This means that patients, for the first time, will have a coherent view of all their health information.","Amida develops patient-centered solutions based on the Blue Button personal health record (PHR), the most popular PHR in the country.",,,,,,2014-01-24 14:36:03.326000,True,False,False,True,False,
Amplify,Amplify,http://www.amplify.com,Brooklyn,NY,11201,,,0,,Private,Education,,"Amplify is reimagining the way teachers teach and students learn. We enable teachers to manage whole classrooms and, at the same time, empower them to offer more personalized instruction, so that students become more active, engaged learners.",Amplify is reimagining the way teachers teach and students learn using the Common Core curriculum.,,,,,,2013-12-15 15:28:21.236000,False,False,,False,True,
Analytica,Analytica,http://www.analytica.net/,Washington DC,DC,20005,,,2007,0,Private,Data/Technology,"Data Management and Analytic Services, Software Licensing","Analytica is a rapidly growing SBA certified HUBZone. The company has supported leading public sector organizations implement innovative, value-driven information technology and consulting solutions focused on managing, analyzing and protecting information.","Analytica assists public sector organizations to identify, leverage, analyze and manage information.","Analytica is a self-funded organization that has seen rapid growth over the past three years. The company is structured financially as an S corporation, and utilizes a December year-end fiscal calendar. The firm maintains an exceptional record of growth, an impeccable credit history, and its financial statements are compiled by a regionally recognized accounting firm. Annual revenues for 2013 were $15.0MM.",1-10,"For the crime data, addition reporting data and additional correlated data would be useful.",,,2014-03-19 17:48:24.124950,True,False,False,True,False,
Apextech-Llc,Apextech LLC,apextechllc.com,Arlington,VA,22201,Frederic,Persi,2003,17,Private,Data/Technology,Data Management and Analytic Services,"Apextech LLC's mission is to provide clients with effective tools and methods to measure their performance. As your provider of choice, Apextech addresses, analyzes, and evaluates current business processes and systems in order to effectively modify or augment our client’s capabilities. Our solutions are forward-thinking, flexible and scalable.","Apextech LLC, a commercial and government consulting firm, offers clients and partners innovative solutions to heighten business performance.","We have developed solutions in the international development space for NGOs and are working towards integrating those systems with governmental development data from USAID, the World Bank, the EU and the CIDA (Canadian International Development Agency).",,,"USAID impact data:  data that shows objectives that are being achieved.
USAID  grant data:  financial expenditures reported by grantees and awards.
Same data from EU, World Bank and EU.",,2013-12-15 15:27:46.668000,True,False,True,True,True,
Apixio,Apixio,http://www.apixio.com,San Mateo,CA,94402,,,0,,Private,Healthcare,,"Our value proposition reaches far beyond our partner companies, delivering direct benefits to healthcare providers, as well as patients. Apixio is setting out to develop a connected world where medical information becomes liquid thereby enabling a whole host of existing and new technology providers to move, transact, search, analyze and display medical information.","Apixio's mission is to improve healthcare by providing instant access to relevant clinical information, anywhere.",,,,,,2013-12-15 15:28:21.259000,False,False,,False,True,
ApolloBravo-Inc,ApolloBravo Inc,http://www.apollobravo.com,Alexandria,VA,22314,,,0,,,Data/Technology,,,"ApolloBravo manages mobile, social and digital campaigns from ideation to full-scale execution and reporting. ",,,,,,2013-12-15 15:28:21.282000,False,False,,False,True,
Appallicious,Appallicious,appallicious.com,San Francisco,CA,94104,Yo,Yoshida,2010,13,Private,Data/Technology,Software Licensing,"Appallicious' mission is to create the premiere mobile app platform for local governments who want to utilize technology to improve the overall efficiency of their city and foster better communication between local residents and elected leaders. With Appallicious' Skipitt platform, a variety of mobile apps can be created using open data feeds from local, state and federal government sources. 

Appallicious created the San Francisco's Rec & Park app, featured by the U.S. Department of Energy. The app lets users find parks, playgrounds, museums, recreation centers, picnic tables, and restrooms, all provided with descriptions and displayed on a GPS enabled map. Searching through the simple and easy to use interface brings efficiency, transparency, and exposure to the services and facilities maintained by the City and County of SF.

Appallicious has also developed Neighborhood Score, which was launched by San Francisco Mayor Ed Lee. Neighborhood Score uses data sets to allow residents to see how their neighborhoods rank in public safety, quality of schools, crime rates, air quality, and more.",The Appallicious Mobile Commerce Platform is a leading technology for government and business to go mobile.,"In March 2012, a neighbor of Appallicious co-founder, Yo Yoshida, died tragically after falling through a dilapidated staircase in Yo's apartment. After her death, Yo was inspired to create an application that would provide San Francisco residents with more information about their neighborhoods and the places they live. Neighborhood Score lets you see a score for any block in San Francisco.

Soon Appallicious will be launching Apartment Facts. This service will be a powerful tool for tenants across the country. Apartment Facts will create transparency when it comes to housing safety, accountability, and stopping tragedies like that of Yo's neighbor.",,,"We would like to see the open data legislation that has gone into effect here in San Francisco, replicated all over the country. If every city in the country revised their open data policy, we could create Rec and Park and Neighborhood Score apps everywhere!",,2013-12-15 15:27:46.806000,True,False,True,True,True,
Archimedes-Inc,Archimedes Inc.,http://archimedesmodel.com/,San Francisco,CA,94105,John,Beasley,2006,50,Private,Healthcare,Software Licensing,"Archimedes is a healthcare modelling and analytics organization. With the Archimedes Model at its core, the company enables people to combine real-world healthcare data and simulation data to create compelling and actionable evidence used in individual healthcare decision-making, as well as populations, with applications in health and economic outcomes research, policy creation, and clinical trial design and operations.","Archimedes creates models using evidence from clinical trials, epidemiological studies, and other sources to show healthcare decision makers how different options affect outcomes and costs.",,,,,,2013-12-15 15:27:39.321000,True,False,True,True,True,
Arpin-Van-Lines,Arpin Van Lines,http://www.arpin.com,West Warwick,RI,2893,,,0,0,Private,Transportation,Not reported by company,"Arpin Van Lines is a privately owned moving services company, a subsidiary of Arpin Group,  that specializes in U.S. domestic and worldwide moving and storage services, global information storage management services and environmental stewardship through its various subsidiaries.","Arpin Van Lines, headquartered in West Warwick, Rhode Island, provides household goods moving and storage services for corporate, government, military, and residential customers.",,NA,,,,2013-12-15 15:28:21.306000,False,False,False,False,True,
Arrive-Labs,Arrive Labs,http://home.downloadarrive.com,San Francisco,CA,0,,,0,0,,Transportation,Not reported by company,"Arrive Labs builds software solutions for urban transit solutions, that currently has created two apps - Arrive and TransitHero. 

Arrive is a multi-modal urban transit app for San Francisco providing information across all available modalities like train, bus, taxis, SideCar, ZipCar and our friends, Scoot Networks.

TransitHero, an app for the San Francisco Bay Area, delivers live real-time transit information for BART, MUNI, and AC Transit.  It combines live, crowd sourced reports from our community of users, as well as our proprietary data set to give you intelligence on public transit in the city. You can become a TransitHero by reporting anything from a delay to a crowded train, rescuing transit riders from bad transit experiences before they get stuck.",Arrive Labs builds software solutions for urban transit challenges.,,NA,,,,2013-12-15 15:28:21.329000,False,False,False,False,True,
Asc-Partners,ASC Partners,http://www.asc-partners.com,Boston,MA,0,,,0,0,,Data/Technology,Not reported by company,,"ASC helps companies improve their productivity through state-of-the-art technologies involving business process analyses, back office accounting systems, business applications, software integration, and analytical solutions.",,NA,,,,2013-12-15 15:28:21.356000,False,False,False,False,True,
Asset4,Asset4,asset4.com,New York,NY,10036,,,0,0,Private,Finance & Investment,Not reported by company,"ASSET4 AG provides investment research information on economic, environmental, social, and governance (ESG) aspects of corporate performance. The company provides a database containing ESG information of publicly listed companies, countries, local authorities, state-owned companies, and supranational entities in a Web based architecture. It also provides equity-focused solutions and fixed income solutions for professional investors and corporate executives; extra-financial information for fixed income investments; and carbon data and estimates.","ASSET4 provides objective, comparable and auditable extra-financial information.",,100+,,,,2013-12-15 15:28:21.380000,False,False,False,False,True,
