company_name_id,company_name,url,city,state,zip_code,ceo_first_name,ceo_last_name,year_founded,full_time_employees,company_type,company_category,revenue_source,description,description_short,financial_info,source_count,data_comments,dataset_wishlist,confidentiality,ts,survey_submitted,vetted,locked,vettedByCompany,display,notes
ElectNext,ElectNext,https://electnext.com,New York,NY,10010,,,0,10,Private,Governance,,"ElectNext wants to help anyone, anywhere get informed and engaged on their most important political issues. We're doing this by building the national-to-neighborhood data layer on top of political news that deepens the education, engagement and experience for the political consumer.","ElectNext helps anyone, anywhere get informed and engaged on their most important political issues. ",,,,,,2013-12-15 15:28:23.432000,False,False,,False,True,
Embark,Embark,http://letsembark.com,Cupertino,CA,95014,,,0,3,Private,Transportation,,"Embark, Inc. develops mass transit mobile applications for iPhone and Android users. It serves mass transit riders worldwide. The company was formerly known as Pandav Inc. and changed its name to Embark, Inc. in 2012. Embark, Inc. was founded in 2011 and is based in San Francisco, California.","Embark makes mass transit simple, providing an accurate, reliable, and interactive transit experience that helps you get where you want to go.",,,,,,2013-12-15 15:28:23.455000,False,False,,False,True,
Energy-Points-Inc,"Energy Points, Inc.",energypoints.com,Boston,MA,2108,Ory,Zik,2011,16,Private,Energy,"Software Licensing, Subscriptions","Energy Points uses a unifying metric, big data and comprehensive analytics to manage enterprise energy resources, such as electricity, fuels, water, and materials. The Company's SaaS platform combines advanced analytics with complex resource scarcity data to translate all resources into a unifying metric enabling a direct, one-to-one comparison of domains such as electricity, water, waste and fuel.

The Energy Resource Management (ERM) industry is growing rapidly, similar to Customer Relationship Management a few decades ago. However, the ERM Industry has been struggling to find a simple and accurate, unifying solution that enables operational management and optimization of energy resources (water, electricity, fuel, waste etc.) across enterprises. Energy Points directly addresses how companies can maximize resource efficiency with immediate financial return enhancing operational excellence, sustainability and branding.","Energy Points uses a unifying metric, big data and comprehensive analytics to manage enterprise energy resources, such as electricity, fuels, water, and materials.","We allow organizations to optimize their financial and environmental performance. Our model is entirely business-to-business. We sell two products: a portal designed for organizations that consume multiple resources (electricity, water, etc.) typically in a large portfolio of assets. Our portal allows customers to analyze their portfolio, identify outliers, compare to benchmarks of environmental and financial performance as well as select and track projects. 

The other product is a software development kit (SDK) that serves as a calculation engine for companies that have their own portal.  We don't disclose revenue or funding figures.",,,"Information on municipal water tariffs in the US, rate structures, water tariff changes, relevant water delivery zones, water sources (reservoir and/or aquifer names, etc.) would be of great value. This data would provide tremendous insight into the nation's various water scarcity and quality challenges.",,2013-12-15 15:27:40.802000,True,False,True,True,True,
Energy-Solutions-Forum,Energy Solutions Forum,energysolforum.com,New York,NY,10013,Angelique,Mercurio,2011,4,Private,Energy,Subscriptions,"Energy Solutions Forum (ESF) is an energy policy infotech company. Our data product, EnerKnol, provides energy investors for the first time, access to real-time, comprehensive source of U.S. energy policy information from state, federal, and local regulators, thus driving investments forward by solving the problem of inaccessible fragmented data across 80,000+ government offices. ESF's flagship product, ESF Research, conducts macro- and industry-level analyses around the highly fragmented government regulations and policies that impact energy markets. 

ESF is also the founding sponsor of New York Energy Week, a series of ""for the industry, by the industry"" events, launched to foster collaboration and investment in New York's rapidly growing energy economy. ESF founded the initiative based on the company's broader vision to fuel industry investment through cross-sector data products and research designed for all sectors of the diverse, and often fragmented, energy industry.",Energy Solutions Forum provides the energy industry with U.S. energy and environmental policy information to support growth of domestic energy markets.,,,,State and local agencies policy data,,2013-12-15 15:27:40.938000,True,False,True,True,True,
Enervee-Corporation,Enervee Corporation,http://enervee.com,Santa Monica,CA,90401,Matthias,Kurwig,2010,5,Private,Data/Technology,"Advertising, Data Management and Analytic Services, Lead Generation To Other Businesses, Software Licensing","Enervee® is an energy efficiency data and marketing platform, enabling consumers, businesses and governments to purchase the most energy efficient products.

We connect retailers, manufacturers, governments and utilities to provide an integrated product recommendation platform that is distributed via online, in-store, mobile and social channels.

The Enervee Score provides a universal way of comparing a product’s energy efficiency against all models available on the market. It is updated daily and reflects new products as they are introduced.

Through real time analysis of price, energy cost, popularity and market share, our algorithms produce highly targeted recommendations that can be used in email marketing, direct mail advertising and banner ads. The Enervee partner network provides the opportunity to promote energy efficient products directly to millions of customers at the places they already shop.

Enervee provides the following products and services: government market research & compliance, utility rebate & incentive marketing, retail/manufacturer efficiency score cards & digital ads, and corporate procurement & sustainability.","Enervee® is an energy efficiency data and marketing platform, enabling consumers, businesses and governments to purchase the most energy efficient products.","Enervee is privately funded and we provide data and services to retailers & manufacturers, governments, utilities and corporation.  Enervee provides the following products and services: government market research & compliance, utility rebate & incentive marketing, retail/manufacturer efficiency score cards & digital ads, and corporate procurement & sustainability.",1-10,"We use four main government data sources:

1) DOE's Compliance Certification Database
Good coverage of appliance categories but does not cover electronics categories.  Contain wildcards in model numbers which makes it difficult to identify and match to unique products.  Updated once per year.
2) DOE/EPA's Energy Star
Good coverage of appliance categories but does not cover categories such as dryers or gaming consoles.  Contains wildcards in model numbers which makes it difficult to identify and match to unique products. Data quality varies and updates lag the market.
3) FTC's Appliance Data
Limited coverage of categories.  Contains wildcards in model numbers which makes it difficult to identify and match to unique products. Not updated regularly.
4) California Energy Commission's Appliance Efficiency Database
Good coverage of appliances categories but limited coverage of electronics. Contains wildcards in model numbers which makes it difficult to identify and match to unique products.",,,2013-12-15 15:28:23.501000,True,False,False,True,True,
Enigmaio,Enigma.io,enigma.oi,New York,NY,10012,Jeremy,Bronfman,2010,14,Private,Data/Technology,"Lead Generation To Other Businesses, Subscriptions","Enigma.io is a platform that centralizes, mines and relates big public data about companies, people and locations. Offering one of the largest and broadest repositories of public data on the market, Enigma draws together sources as diverse as SEC filings, government spending contracts, liens, patents, asset ownership, bills of lading, and much more. Enigma's web-based application allows users to connect otherwise disparate and unorganized public data and its full-featured APIs empower developers extend their applications.","By harmonizing and indexing the world's public data, Engima empowers professionals to discover hidden facts and connections like never before.",,100+,,,,2013-12-15 15:27:41.005000,True,False,True,True,True,
Environmental-Data-Resources,Environmental Data Resources,http://www.edrnet.com,Milford,CT,6461,,,0,,,Environment & Weather,,,"Environmental Data provides customers with the solutions they need to assess, understand and manage environmental risk.",,,,,,2013-12-15 15:28:23.523000,False,False,,False,True,
Epsilon,Epsilon,http://www.epsilon.com,Irving,TX,75063,,,0,,,Data/Technology,,,"Epsilon works with leading marketers, using customer intelligence to ignite connections between brands and customers with solutions that integrate rich data, engaging creativity and robust technologies.",,,,,,2013-12-15 15:28:23.546000,False,False,,False,True,
Equifax,Equifax,http://www.equifax.com/home/en_us,Atlanta,GA,30374,,,0,7000,Public,Finance & Investment,,"Equifax can help you better understand your customers and prospects so you can grow your business intelligently across the customer lifecycle. With our market-leading suite of business data, predictive analytics, innovative solutions and industry expertise, you can improve the performance of your marketing and risk management programs to confidently expand your market reach and efficiently grow and protect your revenues.","Equifax leverages one of the largest sources of consumer and commercial data, along with advanced analytics and proprietary technology, to create customized insights for business.",,,,,,2013-12-15 15:28:23.569000,False,False,,False,True,
Ernst--Young-LLP,Ernst & Young LLP,http://www.ey.com,New York,NY,10036,,,0,,,Finance & Investment,,,"Ernst & Young is a leader in assurance, tax, transactions and advisory services. ",,,,,,2013-12-15 15:28:23.594000,False,False,,False,True,
Escholar-Llc,eScholar LLC.,http://www.escholar.com,White Plains,NY,10605,Shawn,Bay,1997,65,Private,Education,Data Management and Analytic Services,eScholar's mission is to leverage secure comprehensive data to help students across the country achieve the best possible education.,"eScholar applies research and data to personalize education, helping agencies to more effectively manage and use data to improve quality and effectiveness of educational programs.",eScholar is a private company primarily owned by the founding team and funds product development entirely from operations.   The economies of scale we achieve by supporting almost half of the US education market allow us to continue to invest heavily in data security and product innovation.,,,,,2013-12-17 00:15:26.162000,True,False,True,True,True,
Esri,Esri,esri.com,Redlands,CA,92373,Jack,Dangermond,1969,3500,Private,Geospatial/Mapping,"Software Licensing, Subscriptions","Esri inspires and enables people to positively impact the future through a deeper, geographic understanding of the changing world around them. At Esri, we believe that geography is at the heart of a more resilient and sustainable future. Governments, industry leaders, academics, and nongovernmental organizations (NGOs) trust us to connect them with the analytic knowledge they need to make these critical decisions that shape the planet.",Esri is the world leader in geographic information systems and has a long history of using open data.,Esri is a privately held company with over $1B US revenue annually. We have offices and distributors in over 80 countries worldwide. The Esri Partner Network has over 2000 members who develop applications for specific use cases. Esri has consistently maintained a financial posture of zero debt.,,,Many. See www.arcgis.com for examples,,2013-12-15 15:27:41.075000,True,False,True,True,True,
Estately,Estately,http://www.estately.com/,Seattle,WA,98102,Galen,Ward,2007,10,Private,Housing/Real Estate,Lead Generation To Other Businesses,"We are a real estate brokerage in 30+ states, publishing residential houses for sale on the internet for consumers.","We are a real estate brokerage in 30+ states, publishing residential houses for sale on the internet for consumers.","We are private, growing in double digits, and have taken about $1m in private financing.",,,"We would like a national standard for data relating to residential houses, and their related taxes, transactions, property records, permit records!",,2013-12-17 00:15:26.228000,True,False,True,True,True,
EverFi,EverFi,http://www.everfi.com,Washington,DC,20007,,,0,,Private,Education,,"EverFi is building and operating the nation's largest network for online education in off-curriculum, but highly valuable content areas such as financial literacy, student loan management, digital literacy, substance abuse prevention and other key life skills for the 21st century student. EverFi’s award-winning, proprietary software-as-a-service platform is designed to provide a highly engaging experience for students and features the latest technology and instructional design, including rich media, high-definition video, 3D simulations and social networking. We work with more than 5,500 schools, colleges and universities in all 50 states. ","EverFi is a leading education technology company focused on teaching, assessing, badging, and certifying students in critical skills.",,,,,,2013-12-15 15:28:23.617000,False,False,,False,True,
Everyday-Health,Everyday Health,http://www.everydayhealth.com,New York,NY,10014,,,0,,Private,Lifestyle & Consumer,,"EverydayHealth.com is a leading provider of online health information. We're here to help you manage your own and your family's conditions and overall well-being through personalized advice, tools, and communities. We're committed to bringing you the most credible and relevant health information available online, and to giving you the best possible user experience. Our information is easy to understand and incorporate into your life every day.","Everyday Health provides expert guidance and daily tools that people need to make the best health choices, actively manage health conditions and live healthier lives every day.",,,,,,2013-12-15 15:28:23.641000,False,False,,False,True,
Evidera,Evidera,http://www.evidera.com,Bethesda,MD,20814,,,0,,,Healthcare,,,"Evidera provides health economics, outcomes research, market access, data analytics and epidemiology services. ",,,,,,2013-12-15 15:28:23.665000,False,False,,False,True,
Expedia,Expedia,www.expedia.com,Bellevue,WA,0,,,0,,,Transportation,,,Expedia Inc. is the American-based parent company to several global online travel brands.,,,,,,2013-12-15 15:28:23.689000,False,False,,False,True,
Experian,Experian,http://www.experian.com,Costa Mesa,CA,92626,,,0,,,Finance & Investment,,,"Experian provides information, analytical tools and marketing services to organizations and consumers to help manage the risk and reward of commercial and financial decisions. ",,,,,,2013-12-15 15:28:23.712000,False,False,,False,True,
Explorys,Explorys,https://www.explorys.com,Cleveland,OH,44106,,,0,,Private,Healthcare,,"Leaders in every industry have one thing in common: effective collaboration through BIG DATA.  BIG DATA is described as high in Volume, Velocity, and Variety -- data that would take too much time and money to load into traditional IT systems and data warehouses for analysis. It is the by-product of interactions between caregivers and patients, as well as those between suppliers, health plans, and payers.  At Explorys, we add Veracity and Value.","Explorys provides a secure software platform that allows healthcare systems to aggregate, analyze, manage, and research their data to provide better patient care in a rapidly changing healthcare market. ",,,,,,2013-12-15 15:28:23.735000,False,False,,False,True,
Exversion,Exversion,https://exversion.com,,,0,Jacek,Grebski,2013,2,Private,Data/Technology,User Fees for Web or Mobile Access,"Exversion aims to improve accessibility and usability of all data. We believe that the future is in comparatively small, well assembled, thoroughly documented data sets.","Exversion allows you to search 140,000+ datasets, consume through one API or upload your own data, and collaborate, publish, share or version-control with  your community.",,,,,,2013-12-17 00:15:26.293000,True,False,True,True,True,
Ezxbrl,Ez-XBRL,ez-xbrl.com,Manassas,VA,22701,Aneet,Kumar,2009,0,Private,Finance & Investment,Software Licensing,"Ez-XBRL Solutions, Inc. is a global provider of products and services for Financial Analytics and Financial Regulatory Compliance. We provide analytics solutions by extracting critical information from SEC filings and other public disclosures. Our team comprises of experts with significant knowledge and experience in a diverse set of domains and technologies, including financial services, XBRL, XML databases, Natural Language Processing and Semantic Analytics. Ez-XBRL is a member of XBRL US and is playing a key role in the development of XBRL standards and global adoption. The company is headquartered in the USA and has operations in the UK and India.","Ez-XBRL uses innovative technologies to provide solutions for financial research, analytics and regulatory compliance.",We have been consistently ranked among the top 4 XBRL product vendors in the US. Over 700 public companies have used our solutions complete regulatory filings. Our revenues have shown consistent growth since 2010 and we are poised for substantial growth within the next 12 months.,,,"Datasets from FINRA, US Courts, USPTO, PACER are among the ones that are unavailable. While some of these datasets are commercially available, they are costly and, therefore, an impediment to innovation.",,2013-12-15 15:27:47.492000,True,False,True,True,True,
FLOODGATE,FLOODGATE,http://www.floodgate.com/#!,Palo Alto,CA,94301,,,0,,,Finance & Investment,,,Floodgate offers a unique fundraising model that bridges the gap between initial seed money raised from traditional “Angel” investors and the much larger investments that characterize traditional venture capitalists. ,,,,,,2013-12-15 15:28:26.815000,False,False,,False,True,
Factiva,Factiva,http://www.dowjones.com/factiva/,Princeton,NJ,0,,,0,,Private,Finance & Investment,,"Factiva is the world's most important collection of news.  With thousands of sources in 28 languages from nearly 200 countries, Factiva provides a comprehensive, curated basis for making better decisions. Factiva unlocks the paywall to critical business facts in specialist publications.  Make faster decisions: Factiva's search results, alerts, newsletters, and charts are about companies, topics, and people that matter to your organization.  Eliminate the noise of the internet and get to relevant information faster.","Factiva, Inc., from Dow Jones, provides essential business news and information together with content delivery tools and services.",,,,,,2013-12-15 15:28:23.784000,False,False,,False,True,
Factset,Factset,http://www.factset.com,Norwalk,CT,6851,,,0,,,Finance & Investment,,,"FactSet consolidates tools to monitor global markets, public and private companies, and equity and fixed income portfolios in a single, intuitive interface.",,,,,,2013-12-15 15:28:23.808000,False,False,,False,True,
Factual,Factual,http://www.factual.com,Los Angeles,CA,90067,Gil,Elbaz,2007,80,Private,Geospatial/Mapping,"Advertising, Data Management and Analytic Services, Subscriptions","Factual's location platform enriches mobile location signals with definitive global data, enabling personalized and contextually relevant mobile experiences. Built from billions of inputs, the data is constantly updated by Factual's real-time data stack.","Factual’s location platform enriches mobile location signals with definitive global data from billions of inputs, enabling personalized and contextually relevant mobile experiences.",,,,,,2013-12-17 00:15:26.358000,True,False,True,True,True,
Farmers,Farmers,http://www.farmers.com,Los Angeles,CA,90010,,,0,,,Insurance,,,"The companies comprising the Farmers Insurance Group of Companies make up one of the country's largest insurers of vehicles, homes and small businesses and provide a wide range of other insurance and financial services products.",,,,,,2013-12-15 15:28:23.830000,False,False,,False,True,
Farmlogs,FarmLogs,farmlogs.com,Ann Arbor,MI,48104,Jesse,Vollmar,2011,7,Private,Food & Agriculture,"Subscriptions, User Fees for Web or Mobile Access","FarmLogs' mission is to invent the future of farming. At FarmLogs we believe farming can leverage web and mobile software to improve efficiency and increase profits. We believe in putting the grower first. Our technology makes farming more efficient and more profitable as demand for food production continues to grow. The hard working people behind growing crops often get overlooked, but ultimately it is the farmer who is at the core of agriculture. By serving the farmer, we are serving the industry that we and our families come from and rely on.","FarmLogs is a way for farmers to forecast and measure profits, track expenses, manage risk, and get informed all from one place.",FarmLogs was a part of Y Combinator and is a VC backed company.,,,Common Land Units (see section 1619 of the farm bill).,,2013-12-15 15:27:41.211000,True,False,True,True,True,
Fastcase,Fastcase,fastcase.com,Washington,DC,20004,Ed,Walters,1999,90,Private,Business & Legal Services,Subscriptions,"Fastcase's mission is to democratize the law and make legal research smarter. Fastcase has created new ways to access the law, with smarter legal research tools and free apps for iOS and Android devices. Fastcase also maintains the Public Library of Law, a free law library for non-lawyers.

Fastcase partners with 24 state bar associations to provide free legal research for their members, and today serve more than 600,000 subscribers.","Fastcase puts the American law library on desktops by providing online access to millions of cases, statutes, and regulations.","Fastcase is a private company, so we don't publicly disclose our financials.  But the company has been growing and profitable since 2005.  We raised a modest round of outside financing in 2003, but have scaled the business based on revenues.

Operationally, we are harvesting public law from thousands of websites every day, and keying large volumes of books.  It would be nice if courts and legislatures released their work in structured or consistent data, but they don't, so a lot of our work is collecting and structuring public law in a consistent format.",,,"PACER would be a great start.  Federal judicial opinions and docket information are public domain, and crucial to our work , and PACER is an expensive and cumbersome way to gain access.",,2013-12-15 15:27:41.352000,True,False,True,True,True,
Fidelity-Investments,Fidelity Investments,https://www.fidelity.com,Boston,MA,2210,,,0,,,Finance & Investment,,,"Fidelity Investments provides a wide range of services, including investment management, retirement planning, brokerage, and human resources and benefits outsourcing services.",,,,,,2013-12-15 15:28:23.853000,False,False,,False,True,
Financial-Insight-Technology-Inc,"Financial Insight Technology, Inc",www.smartasset.com,NYC,NY,10005,Michael,Carvin,2011,9,Private,Finance & Investment,"Advertising, Lead Generation To Other Businesses, Subscriptions",Our mission is to bring transparency to financial decision making.  SmartAsset uses new technology to provide automated answers to important personal finance questions.,SmartAsset uses a wide range of data and new technology to provide automated answers to important personal finance questions.,,,,,,2014-01-07 02:32:41.305000,True,False,,True,False,
Findthebestcom,FindTheBest.com,http://www.findthebest.com,Santa Barbara,CA,93108,Kevin,O'Connor,2010,100,Private,Research & Consulting,"Advertising, Lead Generation To Other Businesses","FindTheBest's mission is to collect, structure, and connect the world’s data — 60+ billion pieces of information to date — to lead people to the best conclusions. Currently, we help 20M+ people a month gain a better perspective on a wide variety of topics by merging a multitude of data sources and putting data in context for the everyday person. Topics range from education to electronics, government to companies, and business to health.","Our mission is to collect, structure, and connect the world’s data to lead people to the best conclusions.","To date, we've raised $17M VC dollars with two major investors being KPCB & Pritzker Group VC.",100+,I seem to be only able to add 4 sources. We use over 100 government data sources. The quality/ability to get them ranges greatly.,"There are many, a few examples include:
IRS 990s (Machine Readable)
Government Contracts (Actual Contract)
Aggregate Suits, Liens, Judgments UCC Filings
Business Complaints & Violations",,2014-03-26 21:24:17.704971,True,False,False,True,False,
Finovate,Finovate,http://finovate.com,Seattle,WA,98105,,,0,,,Finance & Investment,,,Finovate is the first demo-focused conference series in financial technology.,,,,,,2013-12-15 15:28:23.877000,False,False,,False,True,
